{
  "$schema": "../../../schemas/capability-manifest.schema.json",
  "schema_version": "1.1.0",
  "capability_id": "stage_resolution_capability",
  "version": "3.0.0",
  "kind": "tool",
  "status": "candidate",
  "owner": "accounts-payable-platform",
  "provenance": {
    "source_repository": "https://github.com/davidahmann/production-agent-engineering",
    "source_commit": "c4b1d525b8a5ac6f2cc7fafad9639bd08f0de786",
    "publisher": "reference-example-unverified",
    "publisher_verified": false,
    "build_attestation_digest": "sha256:e0d547d34fc46646b84ea0cb4771224b7968d9c8eee6a5f5c774921017cc181e",
    "artifact_digest": "sha256:55e3d2f651125025fd3f1af149a946c04e39c00a91e5aa4dd9b3e191ce938ab0",
    "attestation": {
      "format": "in_toto_statement",
      "algorithm": "Ed25519",
      "key_id": "unverified-reference-builder-key",
      "issuer": "reference-build-example",
      "subject_artifact_digest": "sha256:55e3d2f651125025fd3f1af149a946c04e39c00a91e5aa4dd9b3e191ce938ab0",
      "subject_tool_contract_digest": "sha256:75a3e64646455056bafda9bdca57812b5cf9be8fe7e4075c1230259f24408139",
      "predicate_type": "https://slsa.dev/provenance/v1",
      "location": "https://attestations.example.invalid/stage_resolution_capability/3.0.0",
      "signature": "AAAAAAAAAAAAAAAAAAAAAAAAAAAAAAAAAAAAAAAAAAAAAAAAAAAAAAAAAAAAAAAAAAAAAAAAAAAAAAAAAAAAAA"
    },
    "registry_record": {
      "registry_id": "reference-capability-registry",
      "decision": "candidate",
      "capability_id": "stage_resolution_capability",
      "capability_version": "3.0.0",
      "artifact_digest": "sha256:55e3d2f651125025fd3f1af149a946c04e39c00a91e5aa4dd9b3e191ce938ab0",
      "tool_contract_digest": "sha256:75a3e64646455056bafda9bdca57812b5cf9be8fe7e4075c1230259f24408139",
      "authority_digest": "sha256:043928565961d509453761b4b663d941c18af2a9d830b97e93c47cb2fae18037",
      "verified_at": "2026-08-07T15:00:00Z",
      "expires_at": "2026-08-08T15:00:00Z",
      "decision_digest": "sha256:97bbde46440e8e5cbb08c650af9c9519b7edbd85da5a4d3516cb6af71a146cfd"
    },
    "sbom_uri": "invoice-reference-sbom.spdx",
    "sbom_digest": "sha256:8d3816722ddad1557dc5293c629b7f4ea56dfcc978ad2d11960eee1d9d7ff8cb",
    "licenses": [
      "Apache-2.0"
    ]
  },
  "artifacts": {
    "entrypoint": "invoice-world-fixture/stage_resolution",
    "executable_uri": "../invoice-world-fixture.mjs",
    "instruction_digest": null,
    "executable_digest": "sha256:55e3d2f651125025fd3f1af149a946c04e39c00a91e5aa4dd9b3e191ce938ab0",
    "input_schema_digest": "sha256:c3a49a3bb9042b2284f2107129ad69be3c370cad1c1f3dc692b349732db5e6c6",
    "output_schema_digest": "sha256:77ee79cec50db94df00f294cf781fa581c6398fd1ee7c8c825a376ca2aee9d89",
    "tool_contract": {
      "uri": "../tools/stage-resolution.json",
      "tool_id": "stage_resolution",
      "version": "3.0.0",
      "schema_version": "1.1.0",
      "digest": "sha256:75a3e64646455056bafda9bdca57812b5cf9be8fe7e4075c1230259f24408139"
    }
  },
  "authority": {
    "digest": "sha256:043928565961d509453761b4b663d941c18af2a9d830b97e93c47cb2fae18037",
    "actor_modes": [
      "interactive_delegated"
    ],
    "scopes": [
      "invoice-resolution:stage"
    ],
    "data_classes": [
      "internal",
      "confidential"
    ],
    "effect_ceiling": "staged",
    "egress": "allowlist",
    "destinations": [
      {
        "service_id": "resolution_service",
        "scheme": "https",
        "authority": "resolution-service.internal",
        "port": 443,
        "path_prefix": "/v1/resolutions/stage"
      }
    ],
    "credential_mode": "short_lived_brokered",
    "tenant_binding": true
  },
  "runtime": {
    "sandbox_profile": "isolated-reference-world",
    "network_policy": "operation-scoped-allowlist",
    "resource_profile": "cpu-1-memory-512mb-time-90s",
    "supported_harness_versions": [
      "3.0.0"
    ]
  },
  "lifecycle": {
    "introduced_at": "2026-08-07",
    "review_due": "2026-11-07",
    "eol_at": null,
    "disable_procedure": "Disable stage_resolution_capability by exact manifest and executable digest.",
    "rollback_version": null
  },
  "assurance": {
    "threat_model_uri": "../threat-model.json",
    "evaluation_suite_uri": "../evals",
    "negative_test_ids": [
      "stage_resolution-authority-denial",
      "stage_resolution-digest-mismatch"
    ],
    "approved_by": []
  },
  "control_ids": [
    "TOL-006",
    "SEC-007"
  ]
}
