{
  "$schema": "../../../schemas/capability-manifest.schema.json",
  "schema_version": "1.1.0",
  "capability_id": "retrieve_policy_capability",
  "version": "3.0.0",
  "kind": "tool",
  "status": "candidate",
  "owner": "finance-controls",
  "provenance": {
    "source_repository": "https://github.com/davidahmann/production-agent-engineering",
    "source_commit": "c4b1d525b8a5ac6f2cc7fafad9639bd08f0de786",
    "publisher": "reference-example-unverified",
    "publisher_verified": false,
    "build_attestation_digest": "sha256:8fee7079d3e9ad0fa1df27a6c4190ba667b7959e449c4a474952247dfcc98f06",
    "artifact_digest": "sha256:55e3d2f651125025fd3f1af149a946c04e39c00a91e5aa4dd9b3e191ce938ab0",
    "attestation": {
      "format": "in_toto_statement",
      "algorithm": "Ed25519",
      "key_id": "unverified-reference-builder-key",
      "issuer": "reference-build-example",
      "subject_artifact_digest": "sha256:55e3d2f651125025fd3f1af149a946c04e39c00a91e5aa4dd9b3e191ce938ab0",
      "subject_tool_contract_digest": "sha256:1cae7b5e9bf71462acc9fd83f510e66c3370d5f9e165f89e23085e50ef865437",
      "predicate_type": "https://slsa.dev/provenance/v1",
      "location": "https://attestations.example.invalid/retrieve_policy_capability/3.0.0",
      "signature": "AAAAAAAAAAAAAAAAAAAAAAAAAAAAAAAAAAAAAAAAAAAAAAAAAAAAAAAAAAAAAAAAAAAAAAAAAAAAAAAAAAAAAA"
    },
    "registry_record": {
      "registry_id": "reference-capability-registry",
      "decision": "candidate",
      "capability_id": "retrieve_policy_capability",
      "capability_version": "3.0.0",
      "artifact_digest": "sha256:55e3d2f651125025fd3f1af149a946c04e39c00a91e5aa4dd9b3e191ce938ab0",
      "tool_contract_digest": "sha256:1cae7b5e9bf71462acc9fd83f510e66c3370d5f9e165f89e23085e50ef865437",
      "authority_digest": "sha256:98ed5c30515c47d6ae3078f597c3a88cf2575e5df371f07b70fd3720a52e859e",
      "verified_at": "2026-08-07T15:00:00Z",
      "expires_at": "2026-08-08T15:00:00Z",
      "decision_digest": "sha256:c37a82bc67d290c828a13d3f6a1d5a666daffdc986b7caa1a0ad882d3ea33642"
    },
    "sbom_uri": "invoice-reference-sbom.spdx",
    "sbom_digest": "sha256:8d3816722ddad1557dc5293c629b7f4ea56dfcc978ad2d11960eee1d9d7ff8cb",
    "licenses": [
      "Apache-2.0"
    ]
  },
  "artifacts": {
    "entrypoint": "invoice-world-fixture/retrieve_policy",
    "executable_uri": "../invoice-world-fixture.mjs",
    "instruction_digest": null,
    "executable_digest": "sha256:55e3d2f651125025fd3f1af149a946c04e39c00a91e5aa4dd9b3e191ce938ab0",
    "input_schema_digest": "sha256:2196d06610cd4dcd606aaf1f8e3923f5f96aa1041497e5626d135614fe09e5cf",
    "output_schema_digest": "sha256:179a62877a456496ac1256f7fc6e7fb14f31ccb246aa78c1e8500a69386653ed",
    "tool_contract": {
      "uri": "../tools/retrieve-policy.json",
      "tool_id": "retrieve_policy",
      "version": "3.0.0",
      "schema_version": "1.1.0",
      "digest": "sha256:1cae7b5e9bf71462acc9fd83f510e66c3370d5f9e165f89e23085e50ef865437"
    }
  },
  "authority": {
    "digest": "sha256:98ed5c30515c47d6ae3078f597c3a88cf2575e5df371f07b70fd3720a52e859e",
    "actor_modes": [
      "interactive_delegated"
    ],
    "scopes": [
      "finance-policy:read"
    ],
    "data_classes": [
      "internal"
    ],
    "effect_ceiling": "none",
    "egress": "allowlist",
    "destinations": [
      {
        "service_id": "finance_policy",
        "scheme": "https",
        "authority": "finance-policy.internal",
        "port": 443,
        "path_prefix": "/v1/policies/read"
      }
    ],
    "credential_mode": "short_lived_brokered",
    "tenant_binding": true
  },
  "runtime": {
    "sandbox_profile": "isolated-reference-world",
    "network_policy": "operation-scoped-allowlist",
    "resource_profile": "cpu-1-memory-512mb-time-90s",
    "supported_harness_versions": [
      "3.0.0"
    ]
  },
  "lifecycle": {
    "introduced_at": "2026-08-07",
    "review_due": "2026-11-07",
    "eol_at": null,
    "disable_procedure": "Disable retrieve_policy_capability by exact manifest and executable digest.",
    "rollback_version": null
  },
  "assurance": {
    "threat_model_uri": "../threat-model.json",
    "evaluation_suite_uri": "../evals",
    "negative_test_ids": [
      "retrieve_policy-authority-denial",
      "retrieve_policy-digest-mismatch"
    ],
    "approved_by": []
  },
  "control_ids": [
    "TOL-006",
    "SEC-007"
  ]
}
